{
  "schema_version": "1.0.0",
  "release_id": "INTERNAL-LIVE-V1-CANDIDATE",
  "environment": "INTERNAL_MANAGED",
  "generated_at": "2026-09-06T00:16:41.797Z",
  "frozen_version": {
    "repository": "github.com/backen-pixel/Quanlycongviec",
    "commit": "UNSET",
    "tree": "UNSET",
    "clean": false
  },
  "overall_status": "FOUNDER DECISION REQUIRED",
  "modules": [
    {
      "module_key": "founder_cockpit",
      "display_name": "Founder Executive Cockpit — Tổng quan 6 hệ",
      "status": "LIVE WITH DATA GAPS",
      "source_type": "APPROVED_READ_MODEL",
      "data_updated_at": "2026-09-06T00:16:41.797Z",
      "freshness_slo_minutes": 15,
      "gates": { "scope": true, "permission": true, "audit": true, "reconciliation": false, "drill_down": true },
      "controlled_actions": { "enabled": false, "application_services": [] },
      "evidence": ["Real-data smoke returned six systems, fifteen modules, five scoped companies, two manufacturing views, and zero write capabilities."],
      "gaps": ["Warranty/Care has no approved read source; several cross-domain signal definitions and capacity targets remain explicit gaps."]
    },
    {
      "module_key": "founder_configuration",
      "display_name": "Founder Configuration Center",
      "status": "LIVE WITH DATA GAPS",
      "source_type": "APPROVED_READ_MODEL",
      "data_updated_at": "2026-09-06T00:16:41.797Z",
      "freshness_slo_minutes": 15,
      "gates": { "scope": true, "permission": true, "audit": true, "reconciliation": true, "drill_down": true },
      "controlled_actions": { "enabled": false, "application_services": [] },
      "evidence": ["Configuration Center reads the built-in route registry and existing app-module registry, then drills down to the canonical configuration screen."],
      "gaps": ["The cockpit intentionally performs no configuration write; changes remain protected in existing application services."]
    },
    {
      "module_key": "ecosystem_company_scope",
      "display_name": "Ecosystem and Company Scope",
      "status": "LIVE",
      "source_type": "CANONICAL_MODULE",
      "data_updated_at": "2026-09-06T00:16:41.797Z",
      "freshness_slo_minutes": 5,
      "gates": { "scope": true, "permission": true, "audit": true, "reconciliation": true, "drill_down": true },
      "controlled_actions": { "enabled": false, "application_services": [] },
      "evidence": ["Real-data acceptance covered five companies; one cross-company and one cross-tenant request were denied with no cockpit payload."],
      "gaps": []
    },
    {
      "module_key": "crm",
      "display_name": "CRM",
      "status": "LIVE",
      "source_type": "APPROVED_READ_MODEL",
      "data_updated_at": "2026-09-06T00:16:41.797Z",
      "freshness_slo_minutes": 15,
      "gates": { "scope": true, "permission": true, "audit": true, "reconciliation": true, "drill_down": true },
      "controlled_actions": { "enabled": false, "application_services": [] },
      "evidence": ["Existing organization-overview read model returned current company-scoped CRM data."],
      "gaps": []
    },
    {
      "module_key": "sales",
      "display_name": "Sales",
      "status": "LIVE",
      "source_type": "APPROVED_READ_MODEL",
      "data_updated_at": "2026-09-06T00:16:41.797Z",
      "freshness_slo_minutes": 15,
      "gates": { "scope": true, "permission": true, "audit": true, "reconciliation": true, "drill_down": true },
      "controlled_actions": { "enabled": false, "application_services": [] },
      "evidence": ["Sales metrics and source-module drill-down are composed from the existing CRM reporting model."],
      "gaps": []
    },
    {
      "module_key": "lead_deal",
      "display_name": "Lead and Deal",
      "status": "LIVE",
      "source_type": "APPROVED_READ_MODEL",
      "data_updated_at": "2026-09-06T00:16:41.797Z",
      "freshness_slo_minutes": 15,
      "gates": { "scope": true, "permission": true, "audit": true, "reconciliation": true, "drill_down": true },
      "controlled_actions": { "enabled": false, "application_services": [] },
      "evidence": ["Lead/deal counts and values use the existing CRM organization-overview read model."],
      "gaps": []
    },
    {
      "module_key": "commercial_documents",
      "display_name": "Quotation, Contract, and Order",
      "status": "LIVE WITH DATA GAPS",
      "source_type": "APPROVED_READ_MODEL",
      "data_updated_at": "2026-09-06T00:16:41.797Z",
      "freshness_slo_minutes": 15,
      "gates": { "scope": true, "permission": true, "audit": true, "reconciliation": true, "drill_down": true },
      "controlled_actions": { "enabled": false, "application_services": [] },
      "evidence": ["Accounting summary and canonical quotation/order drill-down are connected."],
      "gaps": ["The cockpit does not yet summarize legal contract status or the full quotation/order lifecycle."]
    },
    {
      "module_key": "project",
      "display_name": "Project",
      "status": "LIVE WITH DATA GAPS",
      "source_type": "APPROVED_READ_MODEL",
      "data_updated_at": "2026-09-05T22:01:50.396Z",
      "freshness_slo_minutes": 30,
      "gates": { "scope": true, "permission": true, "audit": true, "reconciliation": true, "drill_down": true },
      "controlled_actions": { "enabled": false, "application_services": [] },
      "evidence": ["Current canonical project rows are company-scoped and linked to Work Unified drill-down."],
      "gaps": ["No approved cross-domain Project Health model yet covers all milestones and blockers."]
    },
    {
      "module_key": "work_unified",
      "display_name": "Work Unified",
      "status": "LIVE",
      "source_type": "APPROVED_READ_MODEL",
      "data_updated_at": "2026-09-06T00:16:41.797Z",
      "freshness_slo_minutes": 15,
      "gates": { "scope": true, "permission": true, "audit": true, "reconciliation": true, "drill_down": true },
      "controlled_actions": { "enabled": false, "application_services": [] },
      "evidence": ["Unified Tasks view supplies current week/month/quarter workload with canonical module drill-down."],
      "gaps": []
    },
    {
      "module_key": "procurement_purchasing",
      "display_name": "Procurement and Purchasing",
      "status": "LIVE WITH DATA GAPS",
      "source_type": "APPROVED_READ_MODEL",
      "data_updated_at": "2026-07-15T01:56:45.923Z",
      "freshness_slo_minutes": 30,
      "gates": { "scope": true, "permission": true, "audit": true, "reconciliation": true, "drill_down": true },
      "controlled_actions": { "enabled": false, "application_services": [] },
      "evidence": ["Canonical purchase requests are read in place and the existing Purchasing screen is the write/drill-down surface."],
      "gaps": ["Cockpit coverage currently excludes full PO, receipt, and payable lifecycles; the last source mutation is old and must remain visible."]
    },
    {
      "module_key": "production",
      "display_name": "Production",
      "status": "LIVE WITH DATA GAPS",
      "source_type": "APPROVED_READ_MODEL",
      "data_updated_at": "2026-09-05T22:01:50.396Z",
      "freshness_slo_minutes": 30,
      "gates": { "scope": true, "permission": true, "audit": true, "reconciliation": true, "drill_down": true },
      "controlled_actions": { "enabled": false, "application_services": [] },
      "evidence": ["Production project state and canonical production drill-down are connected for two manufacturing companies."],
      "gaps": ["Approved capacity targets are absent; an existing ambiguous stage-to-workshop relationship prevents joined workshop labels in the read model."]
    },
    {
      "module_key": "manufacturing_capacity_view_a",
      "display_name": "Manufacturing Company Capacity View A",
      "status": "LIVE WITH DATA GAPS",
      "source_type": "APPROVED_READ_MODEL",
      "data_updated_at": "2026-09-05T22:01:50.396Z",
      "freshness_slo_minutes": 60,
      "gates": { "scope": true, "permission": true, "audit": true, "reconciliation": true, "drill_down": true },
      "controlled_actions": { "enabled": false, "application_services": [] },
      "evidence": ["Company-scoped production projects, open work, active people, and load per active person are connected."],
      "gaps": ["No Founder-approved capacity target exists; target and gap remain null rather than synthetic."]
    },
    {
      "module_key": "manufacturing_capacity_view_b",
      "display_name": "Manufacturing Company Capacity View B",
      "status": "LIVE WITH DATA GAPS",
      "source_type": "APPROVED_READ_MODEL",
      "data_updated_at": "2026-09-05T22:01:50.396Z",
      "freshness_slo_minutes": 60,
      "gates": { "scope": true, "permission": true, "audit": true, "reconciliation": true, "drill_down": true },
      "controlled_actions": { "enabled": false, "application_services": [] },
      "evidence": ["A second manufacturing-company view uses the same scoped canonical contracts without duplicating state."],
      "gaps": ["No Founder-approved capacity target exists; target and gap remain null rather than synthetic."]
    },
    {
      "module_key": "logistics_delivery_installation",
      "display_name": "Logistics, Delivery, and Installation",
      "status": "LIVE WITH DATA GAPS",
      "source_type": "APPROVED_READ_MODEL",
      "data_updated_at": "2026-09-05T22:01:50.396Z",
      "freshness_slo_minutes": 30,
      "gates": { "scope": true, "permission": true, "audit": true, "reconciliation": true, "drill_down": true },
      "controlled_actions": { "enabled": false, "application_services": [] },
      "evidence": ["Project-level delivery signals and canonical Logistics drill-down are connected."],
      "gaps": ["Detailed delivery, installation, and acceptance evidence remains in the source module rather than the cockpit aggregate."]
    },
    {
      "module_key": "accounting",
      "display_name": "Accounting",
      "status": "LIVE",
      "source_type": "APPROVED_READ_MODEL",